Title,Status,Notes
وظيفة خدمة العملاء – مركز أمر,مكتمل,تعلمت أساسيات التواصل وخدمة المتعاملين
موظفة إدخال بيانات – مركز أمر,مكتمل,خبرة في النظام والإجراءات الحكومية
قسم الموارد البشرية – مركز أمر,مكتمل,أرشفة، مقابلات، تجهيز رواتب، علاقات موظفين
بنك الاستثمار – قسم العملاء,مكتمل,خبرة مالية ومهارات مصرفية
دبلوم إدارة الموارد البشرية + دبلوم إدارة أعمال,مكتمل,دبلومات مهنية معتمدة (2023)
AWS Cloud Computing – دورة منارة,قيد التنفيذ,حالياً أدرس وأطور نفسي في الكلاود
منصة BrightPath التعليمية,تم الإنشاء,أول منصة بسيطة بلغة HTML وCSS مرفوعة على GitHub
GitHub Projects – Career Journey,تم التوثيق,بدأت توثيق مسيرتي التعليمية والوظيفية
